{
  "sources": {
    "demo-feed-a": {
      "independence_group": "fictional-a",
      "official_kinds": []
    },
    "demo-feed-b": {
      "independence_group": "fictional-b",
      "official_kinds": []
    },
    "demo-official": {
      "independence_group": "fictional-official",
      "official_kinds": [
        "corner.awarded",
        "goal.scored",
        "period.closed",
        "event.abandoned"
      ]
    }
  },
  "licences": [
    {
      "schema_version": "0.1",
      "licence_id": "synthetic-licence",
      "source_ids": [
        "demo-feed-a",
        "demo-feed-b",
        "demo-official"
      ],
      "uses": [
        "display",
        "pricing",
        "settlement",
        "redistribution"
      ],
      "territories": [
        "TEST"
      ],
      "valid_from": "2026-01-01T00:00:00Z",
      "valid_until": "2027-01-01T00:00:00Z",
      "fact_types": [
        "corner.awarded",
        "goal.scored",
        "period.closed",
        "event.abandoned"
      ],
      "synthetic": true
    }
  ],
  "rulepacks": [
    {
      "schema_version": "0.1",
      "rulepack_id": "TEST-2026",
      "version": "0.1.0",
      "jurisdiction": "TEST",
      "basis": "synthetic",
      "reviewer": "Fictional test-policy author",
      "reviewed_at": "2025-12-31T00:00:00Z",
      "valid_from": "2026-01-01T00:00:00Z",
      "valid_until": "2027-01-01T00:00:00Z",
      "allow_consumer": false,
      "min_window_seconds": 900,
      "allowed_fact_types": [
        "corner.awarded",
        "goal.scored"
      ],
      "required_state": "official"
    }
  ],
  "market": {
    "schema_version": "0.1",
    "market_id": "demo-corners-h2-over-4.5",
    "event_id": "synthetic-match-001",
    "name": "Fictional second-half corners over 4.5",
    "settlement": {
      "fact_type": "corner.awarded",
      "period": 2,
      "threshold": 5,
      "min_state": "official"
    },
    "outcomes": [
      "over",
      "under"
    ],
    "close_at": "2026-01-01T12:45:00Z",
    "correction_deadline": "2026-01-02T14:00:00Z",
    "jurisdiction": "TEST",
    "licence_id": "synthetic-licence",
    "rulepack_id": "TEST-2026",
    "consumer": false,
    "window_seconds": 2700,
    "participant_scope": "aggregate",
    "batch_window_ms": 250
  }
}
